{
  "schema_version": "2.0",
  "batch_id": "10000000-0000-4000-8000-000000000351",
  "collector_epoch": "20000000-0000-4000-8000-000000000001",
  "sequence": 1,
  "sent_at": "2026-09-25T08:00:00Z",
  "objects": [
    {
      "ref": "o_ns",
      "kind": "k8s.namespace",
      "native": {"name": "payments"}
    }
  ],
  "observations": [
    {
      "event_id": "e-admit-1",
      "kind": "admission.actor",
      "subject_ref": "o_ns",
      "observed_at": "2026-09-25T07:59:58Z",
      "outcome": "success",
      "attribution": "system:serviceaccount:payments:controller",
      "preview": true
    }
  ],
  "applied": [],
  "health": {
    "events_lost": 0,
    "queue_depth": 1,
    "partitions_partial": 1,
    "partitions_forbidden": 0,
    "poison_isolated": 2,
    "idempotency_conflicts": 3
  }
}
